Term	Overlap	P-value	Adjusted P-value	Old P-value	Old Adjusted P-value	Odds Ratio	Combined Score	Genes
The citric acid (TCA) cycle and respiratory electron transport Homo sapiens R-HSA-1428517	14/153	3.23554037184849E-8	1.476248145558404E-5	0	0	7.442595357676123	128.3586076397764	NDUFA8;COX7B;UQCRB;NDUFA4;COX18;UCP1;ATP5C1;SDHB;ATP5J2;COX6B1;UQCRQ;SUCLG1;UQCRC2;HAGH
Respiratory electron transport, ATP synthesis by chemiosmotic coupling, and heat production by uncoupling proteins. Homo sapiens R-HSA-163200	12/109	4.038982614386878E-8	1.476248145558404E-5	0	0	9.092551835978224	154.79785732953331	NDUFA8;COX7B;UQCRB;UQCRQ;NDUFA4;COX18;UCP1;ATP5C1;UQCRC2;SDHB;ATP5J2;COX6B1
Eukaryotic Translation Termination Homo sapiens R-HSA-72764	10/87	3.692549448580685E-7	8.997512156374936E-5	0	0	9.483899000627625	140.47341154126363	N6AMT1;TRMT112;RPS27;RPL10;RPS29;RPS3;RPL23A;RPS2;RPL39;UBA52
Translation Homo sapiens R-HSA-72766	12/151	1.4370000852262876E-6	2.6261176557510407E-4	0	0	6.331581925470859	85.1784733724053	N6AMT1;TRMT112;TRAM1;RPS27;SSR4;RPL10;RPS29;RPS3;RPL23A;RPS2;RPL39;UBA52
SRP-dependent cotranslational protein targeting to membrane Homo sapiens R-HSA-1799339	10/107	2.5390479084833343E-6	3.7120880422026345E-4	0	0	7.520791016747787	96.8957760649935	TRAM1;RPS27;SSR4;RPL10;RPS29;RPS3;RPL23A;RPS2;RPL39;UBA52
Respiratory electron transport Homo sapiens R-HSA-611105	9/88	3.837178768090009E-6	4.6749627991229936E-4	0	0	8.28776371308017	103.35482124626125	NDUFA8;COX7B;UQCRB;NDUFA4;UQCRQ;COX18;UQCRC2;SDHB;COX6B1
Influenza Viral RNA Transcription and Replication Homo sapiens R-HSA-168273	10/128	1.2682785928911538E-5	0.0013244452162906194	0	0	6.175729317623338	69.63298414650806	RPS27;RPL10;RPS29;RPS3;RPL23A;RPS2;RPL39;UBA52;POLR2J;POLR2L
Nonsense-Mediated Decay (NMD) Homo sapiens R-HSA-927802	9/106	1.7728014695482177E-5	0.001377216000825782	0	0	6.743642611683849	73.77790767966204	RPS27;RPL10;RPS29;EIF4A3;RPS3;RPL23A;RPS2;RPL39;UBA52
Nonsense Mediated Decay (NMD) enhanced by the Exon Junction Complex (EJC) Homo sapiens R-HSA-975957	9/106	1.7728014695482177E-5	0.001377216000825782	0	0	6.743642611683849	73.77790767966204	RPS27;RPL10;RPS29;EIF4A3;RPS3;RPL23A;RPS2;RPL39;UBA52
Influenza Life Cycle Homo sapiens R-HSA-168255	10/136	2.1554964298784022E-5	0.001377216000825782	0	0	5.78125921992093	62.1190776646526	RPS27;RPL10;RPS29;RPS3;RPL23A;RPS2;RPL39;UBA52;POLR2J;POLR2L
Viral mRNA Translation Homo sapiens R-HSA-192823	8/84	2.2608197003980008E-5	0.001377216000825782	0	0	7.630607885026219	81.62612354501559	RPS27;RPL10;RPS29;RPS3;RPL23A;RPS2;RPL39;UBA52
Peptide chain elongation Homo sapiens R-HSA-156902	8/84	2.2608197003980008E-5	0.001377216000825782	0	0	7.630607885026219	81.62612354501559	RPS27;RPL10;RPS29;RPS3;RPL23A;RPS2;RPL39;UBA52
Selenocysteine synthesis Homo sapiens R-HSA-2408557	8/87	2.9231081169810692E-5	0.001643686179625509	0	0	7.339716941473212	76.6286852454329	RPS27;RPL10;RPS29;RPS3;RPL23A;RPS2;RPL39;UBA52
Eukaryotic Translation Elongation Homo sapiens R-HSA-156842	8/89	3.449180538280426E-5	0.0016809006489886611	0	0	7.157760466493554	73.54447698313992	RPS27;RPL10;RPS29;RPS3;RPL23A;RPS2;RPL39;UBA52
Nonsense Mediated Decay (NMD) independent of the Exon Junction Complex (EJC) Homo sapiens R-HSA-975956	8/89	3.449180538280426E-5	0.0016809006489886611	0	0	7.157760466493554	73.54447698313992	RPS27;RPL10;RPS29;RPS3;RPL23A;RPS2;RPL39;UBA52
Influenza Infection Homo sapiens R-HSA-168254	10/147	4.21064555997269E-5	0.0019019460023637666	0	0	5.314085691802567	53.54105799794529	RPS27;RPL10;RPS29;RPS3;RPL23A;RPS2;RPL39;UBA52;POLR2J;POLR2L
Metabolism of proteins Homo sapiens R-HSA-392499	32/1074	4.423130238055271E-5	0.0019019460023637666	0	0	2.3224101890633864	23.28466528755395	N6AMT1;DCTN6;RAB1A;TRAM1;CALCA;ACADVL;RPL10;GALNT18;TRMT112;ASNA1;CHST10;DAG1;RPS3;MAN1C1;RPS2;ADAMTS8;RPL39;CCT3;SEC13;TRAPPC1;SSR4;DOLK;RPL23A;GNG12;TUBB4B;SEC23IP;DPM3;RPS27;RPS29;DAD1;UBA52;B4GALT5
Formation of a pool of free 40S subunits Homo sapiens R-HSA-72689	8/96	5.9543207493698495E-5	0.0024181158154385333	0	0	6.586044951358605	64.07436900156678	RPS27;RPL10;RPS29;RPS3;RPL23A;RPS2;RPL39;UBA52
L13a-mediated translational silencing of Ceruloplasmin expression Homo sapiens R-HSA-156827	8/106	1.2012928767734402E-4	0.004390725464606924	0	0	5.910987273138037	53.3581392646287	RPS27;RPL10;RPS29;RPS3;RPL23A;RPS2;RPL39;UBA52
3' -UTR-mediated translational regulation Homo sapiens R-HSA-157279	8/106	1.2012928767734402E-4	0.004390725464606924	0	0	5.910987273138037	53.3581392646287	RPS27;RPL10;RPS29;RPS3;RPL23A;RPS2;RPL39;UBA52
GTP hydrolysis and joining of the 60S ribosomal subunit Homo sapiens R-HSA-72706	8/107	1.2829146178934732E-4	0.004465764693714899	0	0	5.850982146185098	52.43185536264872	RPS27;RPL10;RPS29;RPS3;RPL23A;RPS2;RPL39;UBA52
Selenoamino acid metabolism Homo sapiens R-HSA-2408522	8/111	1.6565843845413664E-4	0.0052626789025142905	0	0	5.622613119335077	48.94812231437539	RPS27;RPL10;RPS29;RPS3;RPL23A;RPS2;RPL39;UBA52
Metabolism Homo sapiens R-HSA-1430728	46/1908	1.682913585644168E-4	0.0052626789025142905	0	0	1.893561309773514	16.45469520747	N6AMT1;PECR;COX7B;ACADVL;RPL10;UQCRB;COX18;UCP1;APIP;ATP5C1;TRMT112;ESD;RPS3;CHP1;RPS2;RPL39;ACOT9;NDUFA8;GSTM1;NDUFA4;MBOAT7;NME2;RPL23A;HS3ST5;GNG12;SDHB;ATP5J2;COX6B1;COQ3;RPS27;RPS29;UQCRQ;FABP7;LPCAT3;CPTP;BLVRB;SUCLG1;SLC25A10;UQCRC2;FAR2;HAGH;GCLM;UBA52;ITPA;PNPLA2;B4GALT5
TP53 Regulates Metabolic Genes Homo sapiens R-HSA-5628897	7/84	1.7278289146421748E-4	0.0052626789025142905	0	0	6.565508021390374	56.88011272936435	COX7B;RRAGA;NDUFA4;COX18;MTOR;COX6B1;LAMTOR5
Cap-dependent Translation Initiation Homo sapiens R-HSA-72737	8/114	1.9920530761731556E-4	0.005600733841086834	0	0	5.462647079300981	46.54816936884945	RPS27;RPL10;RPS29;RPS3;RPL23A;RPS2;RPL39;UBA52
Eukaryotic Translation Initiation Homo sapiens R-HSA-72613	8/114	1.9920530761731556E-4	0.005600733841086834	0	0	5.462647079300981	46.54816936884945	RPS27;RPL10;RPS29;RPS3;RPL23A;RPS2;RPL39;UBA52
Transcriptional Regulation by TP53 Homo sapiens R-HSA-3700989	14/348	4.0604760632253123E-4	0.010993362971176679	0	0	3.066523556660264	23.946605569620345	COX7B;NDUFA4;COX18;CHM;MTOR;COX6B1;RRAGA;CNOT6;CASP6;TAF9B;UBA52;POLR2J;LAMTOR5;POLR2L
p75NTR recruits signalling complexes Homo sapiens R-HSA-209543	3/13	6.924736733180608E-4	0.017455112248120776	0	0	21.425	155.87202423082323	NGFR;IRAK1;UBA52
NF-kB is activated and signals survival Homo sapiens R-HSA-209560	3/13	6.924736733180608E-4	0.017455112248120776	0	0	21.425	155.87202423082323	NGFR;IRAK1;UBA52
rRNA processing Homo sapiens R-HSA-72312	9/180	9.859485787719227E-4	0.024024280369409182	0	0	3.810916179337232	26.378804924198676	TRMT112;RPS27;RPL10;RPS29;RPS3;RPL23A;RPS2;RPL39;UBA52
Asparagine N-linked glycosylation Homo sapiens R-HSA-446203	11/259	0.0010808755146415926	0.024565118022681073	0	0	3.222842441020703	22.011961999070603	DCTN6;RAB1A;SEC13;SEC23IP;DPM3;TRAPPC1;DAD1;CHST10;MAN1C1;DOLK;B4GALT5
Mitochondrial translation initiation Homo sapiens R-HSA-5368286	6/84	0.0011425636289619104	0.024565118022681073	0	0	5.534798534798535	37.495386095917866	MRPL30;MRPS36;MRPL18;MRPS18B;MRPS21;MRPL46
Mitochondrial translation termination Homo sapiens R-HSA-5419276	6/84	0.0011425636289619104	0.024565118022681073	0	0	5.534798534798535	37.495386095917866	MRPL30;MRPS36;MRPL18;MRPS18B;MRPS21;MRPL46
Mitochondrial translation elongation Homo sapiens R-HSA-5389840	6/84	0.0011425636289619104	0.024565118022681073	0	0	5.534798534798535	37.495386095917866	MRPL30;MRPS36;MRPL18;MRPS18B;MRPS21;MRPL46
p75NTR signals via NF-kB Homo sapiens R-HSA-193639	3/16	0.001314527735026268	0.02745485069440577	0	0	16.47826086956522	109.32136051211945	NGFR;IRAK1;UBA52
Mitochondrial translation Homo sapiens R-HSA-5368287	6/90	0.0016328637323642975	0.033156205232175044	0	0	5.1378859236002095	32.97197144541562	MRPL30;MRPS36;MRPL18;MRPS18B;MRPS21;MRPL46
Transport to the Golgi and subsequent modification Homo sapiens R-HSA-948021	8/162	0.0020167032848461236	0.0398435162492572	0	0	3.7508027028322233	23.278573574964362	DCTN6;RAB1A;SEC13;SEC23IP;TRAPPC1;CHST10;MAN1C1;B4GALT5
Organelle biogenesis and maintenance Homo sapiens R-HSA-1852241	12/326	0.002193660605171405	0.04219910269421834	0	0	2.777785729621413	17.006114297535223	MRPL30;CCT3;MRPS36;ARL6;MRPL18;MRPS18B;RHO;MRPS21;IFT122;TUBB4B;WDR35;MRPL46
Major pathway of rRNA processing in the nucleolus Homo sapiens R-HSA-6791226	8/166	0.0023477008580501607	0.044004341723965834	0	0	3.65509832313513	22.12913044977151	RPS27;RPL10;RPS29;RPS3;RPL23A;RPS2;RPL39;UBA52
mTORC1-mediated signalling Homo sapiens R-HSA-166208	3/22	0.003398393198758038	0.06210563570730314	0	0	11.27116704805492	64.07041424148245	RRAGA;MTOR;LAMTOR5
IKK complex recruitment mediated by RIP1 Homo sapiens R-HSA-937041	3/24	0.00437567649809049	0.07801511024644263	0	0	10.196687370600413	55.38528706880351	SARM1;UBE2V1;UBA52
Sulfur amino acid metabolism Homo sapiens R-HSA-1614635	3/25	0.004921620432155729	0.08565963180728187	0	0	9.732707509881424	51.72075078066783	APIP;SLC25A10;GCLM
Formation of the ternary complex, and subsequently, the 43S complex Homo sapiens R-HSA-72695	4/50	0.005158451556222608	0.08769367645578434	0	0	6.221343873517786	32.76855746738839	RPS27;RPS29;RPS3;RPS2
Energy dependent regulation of mTOR by LKB1-AMPK Homo sapiens R-HSA-380972	3/28	0.0067979784341743645	0.11293914171321501	0	0	8.563478260869566	42.741433252955275	RRAGA;MTOR;LAMTOR5
Metabolism of amino acids and derivatives Homo sapiens R-HSA-71291	11/335	0.007662451781743925	0.12236890021567264	0	0	2.4572392666298137	11.970252544640275	RPS27;RPL10;RPS29;RPS3;APIP;SLC25A10;RPL23A;RPS2;GCLM;RPL39;UBA52
IRAK1 recruits IKK complex Homo sapiens R-HSA-937039	2/10	0.00810427583890057	0.12236890021567264	0	0	17.791516245487365	85.6726174976294	IRAK1;UBE2V1
IRAK1 recruits IKK complex upon TLR7/8 or 9 stimulation Homo sapiens R-HSA-975144	2/10	0.00810427583890057	0.12236890021567264	0	0	17.791516245487365	85.6726174976294	IRAK1;UBE2V1
Ribosomal scanning and start codon recognition Homo sapiens R-HSA-72702	4/57	0.008202566498724978	0.12236890021567264	0	0	5.397735849056604	25.926988789817145	RPS27;RPS29;RPS3;RPS2
Translation initiation complex formation Homo sapiens R-HSA-72649	4/57	0.008202566498724978	0.12236890021567264	0	0	5.397735849056604	25.926988789817145	RPS27;RPS29;RPS3;RPS2
Activation of the mRNA upon binding of the cap-binding complex and eIFs, and subsequent binding to 43S Homo sapiens R-HSA-72662	4/58	0.008715567089222092	0.12742159084442697	0	0	5.297508417508418	25.124199327657767	RPS27;RPS29;RPS3;RPS2
TRAF6 mediated IRF7 activation in TLR7/8 or 9 signaling Homo sapiens R-HSA-975110	2/11	0.009814597747874463	0.1406759010528673	0	0	15.813878860810268	73.12154832936902	IRAK1;UBE2V1
Infectious disease Homo sapiens R-HSA-5663205	11/348	0.010020234061579064	0.14086136728873647	0	0	2.360866291686966	10.867418894575989	RPS27;RPL10;RPS29;RPS3;RPL23A;RPS2;TAF9B;RPL39;UBA52;POLR2J;POLR2L
Phase II conjugation Homo sapiens R-HSA-156580	5/100	0.013101996528688006	0.18070866910322514	0	0	3.7698809066461774	16.34239849556295	N6AMT1;TRMT112;GSTM1;ESD;GCLM
Macroautophagy Homo sapiens R-HSA-1632852	4/67	0.014291101694114142	0.19345917293328588	0	0	4.538643578643579	19.280694365025614	RRAGA;ATG4C;MTOR;LAMTOR5
COPII (Coat Protein 2) Mediated Vesicle Transport Homo sapiens R-HSA-204005	4/68	0.015022081749506172	0.19701646125363748	0	0	4.4675	18.75561059044252	RAB1A;SEC13;SEC23IP;TRAPPC1
Post-translational protein modification Homo sapiens R-HSA-597592	14/521	0.015092916320388096	0.19701646125363748	0	0	2.002128688921142	8.395986246520275	DCTN6;RAB1A;SEC13;TRAPPC1;GALNT18;DOLK;SEC23IP;DPM3;DAD1;CHST10;DAG1;MAN1C1;ADAMTS8;B4GALT5
Methylation Homo sapiens R-HSA-156581	2/14	0.015798038943076558	0.19924507957924711	0	0	11.858604091456076	49.18794179874158	N6AMT1;TRMT112
Glutathione conjugation Homo sapiens R-HSA-156590	3/38	0.01580877512393479	0.19924507957924711	0	0	6.113664596273292	25.35452932218763	GSTM1;ESD;GCLM
mTOR signalling Homo sapiens R-HSA-165159	3/39	0.01695315947632656	0.21004677249482567	0	0	5.943538647342995	24.23359644326379	RRAGA;MTOR;LAMTOR5
Constitutive Signaling by NOTCH1 HD Domain Mutants Homo sapiens R-HSA-2691232	2/15	0.018062492284920604	0.21051319434918672	0	0	10.945848375451263	43.9357349762229	MIB2;UBA52
Signaling by NOTCH1 HD Domain Mutants in Cancer Homo sapiens R-HSA-2691230	2/15	0.018062492284920604	0.21051319434918672	0	0	10.945848375451263	43.9357349762229	MIB2;UBA52
NRIF signals cell death from the nucleus Homo sapiens R-HSA-205043	2/15	0.018062492284920604	0.21051319434918672	0	0	10.945848375451263	43.9357349762229	NGFR;UBA52
PKB-mediated events Homo sapiens R-HSA-109703	3/40	0.01814272399999831	0.21051319434918672	0	0	5.782608695652174	23.185286759351218	RRAGA;MTOR;LAMTOR5
Formation of ATP by chemiosmotic coupling Homo sapiens R-HSA-163210	2/16	0.0204550650156011	0.23004080809852928	0	0	10.163486333161423	39.53113163033645	ATP5C1;ATP5J2
TRAF6 mediated induction of TAK1 complex Homo sapiens R-HSA-937072	2/16	0.0204550650156011	0.23004080809852928	0	0	10.163486333161423	39.53113163033645	SARM1;UBA52
RNA Polymerase II HIV Promoter Escape Homo sapiens R-HSA-167162	3/44	0.023354565964024333	0.2371137183291915	0	0	5.217391304347826	19.601544884273395	TAF9B;POLR2J;POLR2L
RNA Polymerase II Promoter Escape Homo sapiens R-HSA-73776	3/44	0.023354565964024333	0.2371137183291915	0	0	5.217391304347826	19.601544884273395	TAF9B;POLR2J;POLR2L
RNA Polymerase II Transcription Initiation And Promoter Clearance Homo sapiens R-HSA-76042	3/44	0.023354565964024333	0.2371137183291915	0	0	5.217391304347826	19.601544884273395	TAF9B;POLR2J;POLR2L
RNA Polymerase II Transcription Initiation Homo sapiens R-HSA-75953	3/44	0.023354565964024333	0.2371137183291915	0	0	5.217391304347826	19.601544884273395	TAF9B;POLR2J;POLR2L
RNA Polymerase II Transcription Pre-Initiation And Promoter Opening Homo sapiens R-HSA-73779	3/44	0.023354565964024333	0.2371137183291915	0	0	5.217391304347826	19.601544884273395	TAF9B;POLR2J;POLR2L
HIV Transcription Initiation Homo sapiens R-HSA-167161	3/44	0.023354565964024333	0.2371137183291915	0	0	5.217391304347826	19.601544884273395	TAF9B;POLR2J;POLR2L
Interleukin-1 signaling Homo sapiens R-HSA-446652	3/44	0.023354565964024333	0.2371137183291915	0	0	5.217391304347826	19.601544884273395	IRAK1;UBE2V1;UBA52
RNA Polymerase III Chain Elongation Homo sapiens R-HSA-73780	2/18	0.025608700868759996	0.25297243696031835	0	0	8.892148014440433	32.58814951912968	POLR1C;POLR2L
Activation of IRF3/IRF7 mediated by TBK1/IKK epsilon Homo sapiens R-HSA-936964	2/18	0.025608700868759996	0.25297243696031835	0	0	8.892148014440433	32.58814951912968	SARM1;UBA52
Disease Homo sapiens R-HSA-1643685	17/725	0.02621710018191716	0.25552933643975256	0	0	1.7424688402984432	6.344927415539797	RPL10;MIB2;RPL23A;MTOR;KAT2A;PORCN;RPS27;RPS29;DAG1;RPS3;RPS2;TAF9B;ADAMTS8;RPL39;UBA52;POLR2J;POLR2L
RNA Polymerase I Transcription Initiation Homo sapiens R-HSA-73762	3/47	0.027740195745700233	0.26580324552975326	0	0	4.860918972332016	17.42577624424097	KAT2A;POLR1C;POLR2L
Citric acid cycle (TCA cycle) Homo sapiens R-HSA-71403	2/19	0.028362042614665874	0.26580324552975326	0	0	8.368655765555319	29.81503965000729	SUCLG1;SDHB
Signaling by FGFR2 IIIa TM Homo sapiens R-HSA-8851708	2/19	0.028362042614665874	0.26580324552975326	0	0	8.368655765555319	29.81503965000729	POLR2J;POLR2L
Pyruvate metabolism and Citric Acid (TCA) cycle Homo sapiens R-HSA-71406	3/48	0.029292618665400873	0.2710494208152916	0	0	4.752657004830918	16.778873999797007	SUCLG1;HAGH;SDHB
RNA Polymerase II Transcription Homo sapiens R-HSA-73857	5/124	0.030037609008714557	0.27446865231712925	0	0	3.005888486781574	10.536556088961497	EIF4A3;SNRPG;TAF9B;POLR2J;POLR2L
Signaling by Hippo Homo sapiens R-HSA-2028269	2/20	0.031228057820039946	0.2807731631203321	0	0	7.903329322101885	27.396403453174507	MOB1A;DVL2
Gene Expression Homo sapiens R-HSA-74160	32/1631	0.03149575838011934	0.2807731631203321	0	0	1.4682860998650473	5.077190023935962	N6AMT1;COX7B;TRAM1;RPL10;COX18;EIF4A3;CHM;HSPB1;TRMT112;CASP6;RPS3;RPS2;TAF9B;RPL39;POLR2J;TRDMT1;POLR2L;RARS2;SSR4;NDUFA4;RPL23A;MTOR;COX6B1;RRAGA;KAT2A;CNOT6;RPS27;RPS29;POLR1C;SNRPG;UBA52;LAMTOR5
NOTCH2 Activation and Transmission of Signal to the Nucleus Homo sapiens R-HSA-2979096	2/21	0.0342030912245543	0.29779370578815606	0	0	7.486984609538286	25.27186173251632	MIB2;UBA52
Cargo trafficking to the periciliary membrane Homo sapiens R-HSA-5620920	3/51	0.0342197965611561	0.29779370578815606	0	0	4.4549365942028984	15.035192515579183	CCT3;ARL6;RHO
mRNA Splicing - Minor Pathway Homo sapiens R-HSA-72165	3/52	0.03595158334913186	0.309183616802534	0	0	4.363797692990239	14.512167725774109	SNRPG;POLR2J;POLR2L
ER to Golgi Anterograde Transport Homo sapiens R-HSA-199977	5/131	0.03676025146275431	0.3124621374334116	0	0	2.8378808944502376	9.374480197842665	DCTN6;RAB1A;SEC13;SEC23IP;TRAPPC1
Formation of TC-NER Pre-Incision Complex Homo sapiens R-HSA-6781823	3/53	0.03772772240939116	0.31699959863522914	0	0	4.276304347826087	14.014989297773273	UBA52;POLR2J;POLR2L
BBSome-mediated cargo-targeting to cilium Homo sapiens R-HSA-5620922	2/23	0.04046598709110697	0.3215286582999913	0	0	6.773250816572117	21.72380320021747	CCT3;ARL6
Deadenylation of mRNA Homo sapiens R-HSA-429947	2/23	0.04046598709110697	0.3215286582999913	0	0	6.773250816572117	21.72380320021747	CNOT6;EIF4A3
RNA Polymerase III Transcription Termination Homo sapiens R-HSA-73980	2/23	0.04046598709110697	0.3215286582999913	0	0	6.773250816572117	21.72380320021747	POLR1C;POLR2L
MicroRNA (miRNA) biogenesis Homo sapiens R-HSA-203927	2/23	0.04046598709110697	0.3215286582999913	0	0	6.773250816572117	21.72380320021747	POLR2J;POLR2L
Abortive elongation of HIV-1 transcript in the absence of Tat Homo sapiens R-HSA-167242	2/23	0.04046598709110697	0.3215286582999913	0	0	6.773250816572117	21.72380320021747	POLR2J;POLR2L
Constitutive Signaling by NOTCH1 HD+PEST Domain Mutants Homo sapiens R-HSA-2894862	3/57	0.045270718846866016	0.33787722379140417	0	0	3.9587359098228663	12.252663081715442	KAT2A;MIB2;UBA52
Signaling by NOTCH1 in Cancer Homo sapiens R-HSA-2644603	3/57	0.045270718846866016	0.33787722379140417	0	0	3.9587359098228663	12.252663081715442	KAT2A;MIB2;UBA52
Signaling by NOTCH1 PEST Domain Mutants in Cancer Homo sapiens R-HSA-2644602	3/57	0.045270718846866016	0.33787722379140417	0	0	3.9587359098228663	12.252663081715442	KAT2A;MIB2;UBA52
Constitutive Signaling by NOTCH1 PEST Domain Mutants Homo sapiens R-HSA-2644606	3/57	0.045270718846866016	0.33787722379140417	0	0	3.9587359098228663	12.252663081715442	KAT2A;MIB2;UBA52
Signaling by NOTCH1 HD+PEST Domain Mutants in Cancer Homo sapiens R-HSA-2894858	3/57	0.045270718846866016	0.33787722379140417	0	0	3.9587359098228663	12.252663081715442	KAT2A;MIB2;UBA52
MyD88-independent TLR3/TLR4 cascade Homo sapiens R-HSA-166166	4/97	0.04692339128422975	0.33787722379140417	0	0	3.0698729227761485	9.391474908385604	IRAK1;SARM1;UBE2V1;UBA52
Toll Like Receptor 3 (TLR3) Cascade Homo sapiens R-HSA-168164	4/97	0.04692339128422975	0.33787722379140417	0	0	3.0698729227761485	9.391474908385604	IRAK1;SARM1;UBE2V1;UBA52
TRIF-mediated TLR3/TLR4 signaling Homo sapiens R-HSA-937061	4/97	0.04692339128422975	0.33787722379140417	0	0	3.0698729227761485	9.391474908385604	IRAK1;SARM1;UBE2V1;UBA52
Formation of tubulin folding intermediates by CCT/TriC Homo sapiens R-HSA-389960	2/25	0.04712304963722351	0.33787722379140417	0	0	6.183644639773976	18.89099121934174	CCT3;TUBB4B
B-WICH complex positively regulates rRNA expression Homo sapiens R-HSA-5250924	3/58	0.047264638854094	0.33787722379140417	0	0	3.8865612648221344	11.861757214674201	KAT2A;POLR1C;POLR2L
Assembly of the primary cilium Homo sapiens R-HSA-5617833	6/187	0.04760787147813219	0.33787722379140417	0	0	2.372654969340052	7.224158216141087	CCT3;ARL6;RHO;IFT122;TUBB4B;WDR35
WNT ligand biogenesis and trafficking Homo sapiens R-HSA-3238698	2/26	0.05059107271264574	0.348887492008906	0	0	5.92569193742479	17.682147097671578	PORCN;WNT9A
N-glycan antennae elongation in the medial/trans-Golgi Homo sapiens R-HSA-975576	2/26	0.05059107271264574	0.348887492008906	0	0	5.92569193742479	17.682147097671578	CHST10;B4GALT5
FGFR2 alternative splicing Homo sapiens R-HSA-6803529	2/26	0.05059107271264574	0.348887492008906	0	0	5.92569193742479	17.682147097671578	POLR2J;POLR2L
Prefoldin mediated transfer of substrate  to CCT/TriC Homo sapiens R-HSA-389957	2/27	0.054147798717709396	0.3565949627265366	0	0	5.688375451263538	16.587518734826208	CCT3;TUBB4B
VEGFR2 mediated vascular permeability Homo sapiens R-HSA-5218920	2/27	0.054147798717709396	0.3565949627265366	0	0	5.688375451263538	16.587518734826208	PAK3;MTOR
RNA Polymerase III Transcription Initiation From Type 2 Promoter Homo sapiens R-HSA-76066	2/27	0.054147798717709396	0.3565949627265366	0	0	5.688375451263538	16.587518734826208	POLR1C;POLR2L
RNA Pol II CTD phosphorylation and interaction with CE Homo sapiens R-HSA-167160	2/27	0.054147798717709396	0.3565949627265366	0	0	5.688375451263538	16.587518734826208	POLR2J;POLR2L
RNA Pol II CTD phosphorylation and interaction with CE Homo sapiens R-HSA-77075	2/27	0.054147798717709396	0.3565949627265366	0	0	5.688375451263538	16.587518734826208	POLR2J;POLR2L
Gap-filling DNA repair synthesis and ligation in TC-NER Homo sapiens R-HSA-6782210	3/62	0.055663057089852586	0.36330084582752	0	0	3.622328666175387	10.462873941387507	UBA52;POLR2J;POLR2L
RNA Polymerase III Transcription Initiation From Type 1 Promoter Homo sapiens R-HSA-76061	2/28	0.05779009782812359	0.36782961029180267	0	0	5.469314079422382	15.592674445078956	POLR1C;POLR2L
RNA Polymerase III Transcription Initiation From Type 3 Promoter Homo sapiens R-HSA-76071	2/28	0.05779009782812359	0.36782961029180267	0	0	5.469314079422382	15.592674445078956	POLR1C;POLR2L
Dual incision in TC-NER Homo sapiens R-HSA-6782135	3/63	0.05786649135917552	0.36782961029180267	0	0	3.5617753623188406	10.149694892252745	UBA52;POLR2J;POLR2L
RNA Polymerase II Pre-transcription Events Homo sapiens R-HSA-674695	3/64	0.06011066594362757	0.36880126782695555	0	0	3.503207412687099	9.849505800170652	TAF9B;POLR2J;POLR2L
PIWI-interacting RNA (piRNA) biogenesis Homo sapiens R-HSA-5601884	2/29	0.0615149097468733	0.36880126782695555	0	0	5.266479475865758	14.685450035857738	POLR2J;POLR2L
mRNA Capping Homo sapiens R-HSA-72086	2/29	0.0615149097468733	0.36880126782695555	0	0	5.266479475865758	14.685450035857738	POLR2J;POLR2L
Cytosolic sensors of pathogen-associated DNA Homo sapiens R-HSA-1834949	3/66	0.06471954925351585	0.36880126782695555	0	0	3.391649413388544	9.285291366865568	POLR1C;UBA52;POLR2L
Class I MHC mediated antigen processing & presentation Homo sapiens R-HSA-983169	8/305	0.06490583622638683	0.36880126782695555	0	0	1.9306471852597313	5.279968158161152	ANAPC13;SEC13;FBXO2;MIB2;UBE2V1;UBA52;ASB3;TRIM11
RNA Polymerase I Promoter Escape Homo sapiens R-HSA-73772	2/30	0.06531924234075888	0.36880126782695555	0	0	5.078133058277462	13.855526647621478	POLR1C;POLR2L
Activated NOTCH1 Transmits Signal to the Nucleus Homo sapiens R-HSA-2122948	2/30	0.06531924234075888	0.36880126782695555	0	0	5.078133058277462	13.855526647621478	MIB2;UBA52
Transcription of the HIV genome Homo sapiens R-HSA-167172	3/67	0.06708338514847798	0.36880126782695555	0	0	3.338485054347826	9.01998194693672	TAF9B;POLR2J;POLR2L
RHO GTPase Effectors Homo sapiens R-HSA-195258	7/255	0.0671623939452791	0.36880126782695555	0	0	2.020739444971537	5.457293416050264	SEC13;CENPF;RPS27;ARPC1B;DVL2;TAX1BP3;PAK3
Reversal of alkylation damage by DNA dioxygenases Homo sapiens R-HSA-73943	1/5	0.0678372591404378	0.36880126782695555	0	0	17.73111510791367	47.70811298418376	ALKBH3
Negative regulation of TCF-dependent signaling by DVL-interacting proteins Homo sapiens R-HSA-5368598	1/5	0.0678372591404378	0.36880126782695555	0	0	17.73111510791367	47.70811298418376	DVL2
N-glycan trimming and elongation in the cis-Golgi Homo sapiens R-HSA-964739	1/5	0.0678372591404378	0.36880126782695555	0	0	17.73111510791367	47.70811298418376	MAN1C1
NGF-independant TRKA activation Homo sapiens R-HSA-187024	1/5	0.0678372591404378	0.36880126782695555	0	0	17.73111510791367	47.70811298418376	NTRK1
Sulfide oxidation to sulfate Homo sapiens R-HSA-1614517	1/5	0.0678372591404378	0.36880126782695555	0	0	17.73111510791367	47.70811298418376	SLC25A10
The fatty acid cycling model Homo sapiens R-HSA-167826	1/5	0.0678372591404378	0.36880126782695555	0	0	17.73111510791367	47.70811298418376	UCP1
The proton buffering model Homo sapiens R-HSA-167827	1/5	0.0678372591404378	0.36880126782695555	0	0	17.73111510791367	47.70811298418376	UCP1
Mitochondrial Uncoupling Proteins Homo sapiens R-HSA-166187	1/5	0.0678372591404378	0.36880126782695555	0	0	17.73111510791367	47.70811298418376	UCP1
O-linked glycosylation Homo sapiens R-HSA-5173105	4/110	0.0681815284874767	0.36880126782695555	0	0	2.6915951972555745	7.228498520543152	GALNT18;DAG1;ADAMTS8;B4GALT5
Pausing and recovery of Tat-mediated HIV elongation Homo sapiens R-HSA-167238	2/31	0.0692001703776259	0.36880126782695555	0	0	4.902776048798706	13.094098713614162	POLR2J;POLR2L
Tat-mediated HIV elongation arrest and recovery Homo sapiens R-HSA-167243	2/31	0.0692001703776259	0.36880126782695555	0	0	4.902776048798706	13.094098713614162	POLR2J;POLR2L
NOD1/2 Signaling Pathway Homo sapiens R-HSA-168638	2/31	0.0692001703776259	0.36880126782695555	0	0	4.902776048798706	13.094098713614162	IRAK1;UBE2V1
Membrane Trafficking Homo sapiens R-HSA-199991	10/420	0.07102737817289398	0.36880126782695555	0	0	1.7509293680297398	4.630665159561341	DCTN6;RAB1A;SEC13;SEC23IP;TRAPPC1;BLOC1S1;ARL1;MAN1C1;UBA52;USE1
Activated TLR4 signalling Homo sapiens R-HSA-166054	4/112	0.07182790812601529	0.36880126782695555	0	0	2.6414814814814815	6.956294425830448	IRAK1;SARM1;UBE2V1;UBA52
Antigen processing: Ubiquitination & Proteasome degradation Homo sapiens R-HSA-983168	7/260	0.07281888117595076	0.36880126782695555	0	0	1.980295280167403	5.187937970253552	ANAPC13;FBXO2;MIB2;UBE2V1;UBA52;ASB3;TRIM11
